{
  "$schema": "https://json-schema.org/draft/2020-12/schema",
  "$id": "https://kotadymo.github.io/vision-language-benchmarks/result.schema.json",
  "title": "Vision-Language Benchmark Result",
  "type": "object",
  "required": [
    "dataset",
    "model",
    "pretrained",
    "task",
    "language",
    "status",
    "benchmark_metadata"
  ],
  "properties": {
    "dataset": {
      "type": "string",
      "minLength": 1
    },
    "model": {
      "type": "string",
      "minLength": 1
    },
    "pretrained": {
      "type": [
        "string",
        "null"
      ]
    },
    "task": {
      "enum": [
        "classification",
        "retrieval"
      ]
    },
    "language": {
      "type": "string",
      "minLength": 2
    },
    "status": {
      "enum": [
        "completed",
        "skipped",
        "failed",
        "blocked"
      ]
    },
    "metrics": {
      "type": "object",
      "properties": {
        "acc1": {
          "type": "number",
          "minimum": 0,
          "maximum": 1
        },
        "acc5": {
          "type": [
            "number",
            "null"
          ],
          "minimum": 0,
          "maximum": 1
        }
      },
      "patternProperties": {
        "^(image|text)_retrieval_recall@(1|5|10)$": {
          "type": "number",
          "minimum": 0,
          "maximum": 1
        }
      },
      "additionalProperties": false
    },
    "benchmark_metadata": {
      "type": "object",
      "required": [
        "schema_version",
        "run_id",
        "timestamp_utc",
        "status",
        "source_commit_sha",
        "framework_name",
        "framework_ref",
        "python_version",
        "uv_lock_sha256",
        "model_repo",
        "checkpoint_revision",
        "pretrained_tag",
        "adapter_name",
        "model_license",
        "dataset_id",
        "dataset_revision",
        "dataset_split",
        "dataset_checksum",
        "dataset_license_status",
        "dataset_terms_confirmed",
        "image_count",
        "text_count",
        "class_count",
        "language",
        "original_language_code",
        "prompt_policy",
        "prompt_name",
        "template_hash",
        "classnames_hash",
        "device",
        "gpu_name",
        "gpu_vram_bytes",
        "driver_version",
        "torch_version",
        "torch_cuda_version",
        "precision",
        "amp_enabled",
        "batch_size_actual",
        "seed",
        "throughput_images_per_sec",
        "throughput_texts_per_sec",
        "inference_ms_median",
        "gpu_peak_allocated_bytes",
        "gpu_peak_reserved_bytes"
      ],
      "properties": {
        "schema_version": {
          "const": "1.0.0"
        },
        "run_id": {
          "type": "string",
          "minLength": 1
        },
        "timestamp_utc": {
          "type": "string",
          "format": "date-time"
        },
        "status": {
          "enum": [
            "completed",
            "skipped",
            "failed",
            "blocked"
          ]
        },
        "reason_if_not_success": {
          "type": [
            "string",
            "null"
          ]
        },
        "source_commit_sha": {
          "type": [
            "string",
            "null"
          ]
        },
        "working_tree_dirty": {
          "type": "boolean"
        },
        "reproducibility_mode": {
          "enum": [
            "exploratory",
            "strict"
          ]
        },
        "expected_source_commit_sha": {
          "type": [
            "string",
            "null"
          ],
          "pattern": "^[0-9a-f]{40}$"
        },
        "staging_directory": {
          "type": [
            "string",
            "null"
          ],
          "minLength": 1
        },
        "framework_name": {
          "const": "vision-language-benchmarks"
        },
        "framework_ref": {
          "const": "v0.1.0"
        },
        "python_version": {
          "type": "string"
        },
        "uv_lock_sha256": {
          "type": [
            "string",
            "null"
          ]
        },
        "model_repo": {
          "type": "string"
        },
        "checkpoint_revision": {
          "type": [
            "string",
            "null"
          ]
        },
        "model_checkpoint_filename": {
          "type": [
            "string",
            "null"
          ]
        },
        "model_checkpoint_size_bytes": {
          "type": [
            "integer",
            "null"
          ],
          "minimum": 1
        },
        "model_languages": {
          "type": "array",
          "items": {
            "type": "string",
            "minLength": 2
          },
          "uniqueItems": true
        },
        "model_architecture": {
          "type": [
            "string",
            "null"
          ]
        },
        "global_embedding_dimension": {
          "type": [
            "integer",
            "null"
          ],
          "minimum": 1
        },
        "experimental_languages": {
          "type": "array",
          "items": {
            "type": "string",
            "minLength": 2
          },
          "uniqueItems": true
        },
        "model_weight_license_status": {
          "enum": [
            "verified",
            "unverified",
            "blocked",
            null
          ]
        },
        "model_weight_license_reason": {
          "type": [
            "string",
            "null"
          ]
        },
        "model_library": {
          "type": [
            "string",
            "null"
          ]
        },
        "model_library_version": {
          "type": [
            "string",
            "null"
          ]
        },
        "expected_checkpoint_components": {
          "type": "array",
          "items": {
            "type": "object",
            "required": [
              "component",
              "kind",
              "filename",
              "sha256",
              "size_bytes",
              "license",
              "license_status"
            ],
            "properties": {
              "component": {
                "type": "string"
              },
              "kind": {
                "enum": [
                  "weight",
                  "tokenizer"
                ]
              },
              "filename": {
                "type": "string"
              },
              "sha256": {
                "type": "string",
                "pattern": "^[0-9a-f]{64}$"
              },
              "size_bytes": {
                "type": "integer",
                "minimum": 1
              },
              "license": {
                "type": "string"
              },
              "license_status": {
                "enum": [
                  "verified",
                  "unverified"
                ]
              }
            },
            "additionalProperties": false
          }
        },
        "checkpoint_components": {
          "type": [
            "array",
            "null"
          ],
          "items": {
            "type": "object",
            "required": [
              "component",
              "kind",
              "filename",
              "sha256",
              "size_bytes",
              "license",
              "license_status",
              "verified"
            ],
            "properties": {
              "component": {
                "type": "string"
              },
              "kind": {
                "enum": [
                  "weight",
                  "tokenizer"
                ]
              },
              "filename": {
                "type": "string"
              },
              "sha256": {
                "type": "string",
                "pattern": "^[0-9a-f]{64}$"
              },
              "size_bytes": {
                "type": "integer",
                "minimum": 1
              },
              "license": {
                "type": "string"
              },
              "license_status": {
                "enum": [
                  "verified",
                  "unverified"
                ]
              },
              "verified": {
                "type": "boolean"
              }
            },
            "additionalProperties": false
          }
        },
        "pretrained_tag": {
          "type": [
            "string",
            "null"
          ]
        },
        "embedding_dimension": {
          "enum": [
            768,
            512,
            256,
            128
          ]
        },
        "embedding_dimension_strategy": {
          "const": "leading-dimensions-l2-v1"
        },
        "native_embedding_dimension": {
          "const": 768
        },
        "embedding_generation_mode": {
          "const": "native_truncate_dim"
        },
        "adapter_name": {
          "type": [
            "string",
            "null"
          ]
        },
        "model_license": {
          "type": "string"
        },
        "dataset_id": {
          "type": "string"
        },
        "dataset_revision": {
          "type": [
            "string",
            "null"
          ]
        },
        "dataset_split": {
          "type": "string"
        },
        "dataset_checksum": {
          "type": [
            "string",
            "null"
          ]
        },
        "dataset_license_status": {
          "enum": [
            "verified",
            "requires_user_confirmation",
            "blocked",
            "unverified",
            "public_download_citation_required",
            "verified_attribution_required"
          ]
        },
        "dataset_terms_confirmed": {
          "type": "boolean"
        },
        "image_count": {
          "type": [
            "integer",
            "null"
          ],
          "minimum": 0
        },
        "text_count": {
          "type": [
            "integer",
            "null"
          ],
          "minimum": 0
        },
        "text_encoding_count": {
          "type": [
            "integer",
            "null"
          ],
          "minimum": 0
        },
        "retrieval_variant": {
          "enum": [
            null,
            "official_first_caption",
            "all_captions"
          ]
        },
        "retrieval_variant_reference_commit": {
          "type": [
            "string",
            "null"
          ]
        },
        "retrieval_variant_source": {
          "type": [
            "string",
            "null"
          ]
        },
        "caption_selection": {
          "type": [
            "string",
            "null"
          ]
        },
        "one_caption_per_image": {
          "type": [
            "boolean",
            "null"
          ]
        },
        "candidate_counts": {
          "type": [
            "object",
            "null"
          ],
          "properties": {
            "images": {
              "type": "integer",
              "minimum": 0
            },
            "texts": {
              "type": "integer",
              "minimum": 0
            }
          },
          "required": [
            "images",
            "texts"
          ],
          "additionalProperties": false
        },
        "official_image_filtering": {
          "type": [
            "object",
            "null"
          ],
          "properties": {
            "rule": {
              "type": "string"
            },
            "reference_commit": {
              "type": "string"
            },
            "included_count": {
              "type": "integer",
              "minimum": 0
            },
            "excluded_count": {
              "type": "integer",
              "minimum": 0
            },
            "excluded_image_ids": {
              "type": "array",
              "items": {
                "type": "string"
              }
            }
          },
          "required": [
            "rule",
            "reference_commit",
            "included_count",
            "excluded_count",
            "excluded_image_ids"
          ],
          "additionalProperties": false
        },
        "caption_count_per_image_min": {
          "type": [
            "integer",
            "null"
          ],
          "minimum": 0
        },
        "caption_count_per_image_max": {
          "type": [
            "integer",
            "null"
          ],
          "minimum": 0
        },
        "text_content_sha256": {
          "type": [
            "string",
            "null"
          ],
          "pattern": "^[0-9a-f]{64}$"
        },
        "image_id_scheme": {
          "type": [
            "string",
            "null"
          ]
        },
        "text_id_scheme": {
          "type": [
            "string",
            "null"
          ]
        },
        "image_ids": {
          "type": [
            "array",
            "null"
          ],
          "items": {
            "type": "string"
          }
        },
        "text_ids": {
          "type": [
            "array",
            "null"
          ],
          "items": {
            "type": "string"
          }
        },
        "image_id_order_hash": {
          "type": [
            "string",
            "null"
          ],
          "pattern": "^[0-9a-f]{64}$"
        },
        "text_id_order_hash": {
          "type": [
            "string",
            "null"
          ],
          "pattern": "^[0-9a-f]{64}$"
        },
        "positive_pair_count": {
          "type": [
            "integer",
            "null"
          ],
          "minimum": 0
        },
        "class_count": {
          "type": [
            "integer",
            "null"
          ],
          "minimum": 0
        },
        "language": {
          "type": "string"
        },
        "original_language_code": {
          "type": [
            "string",
            "null"
          ]
        },
        "prompt_policy": {
          "type": [
            "string",
            "null"
          ]
        },
        "model_input_policy": {
          "type": [
            "object",
            "null"
          ],
          "additionalProperties": true
        },
        "preprocessing_identity": {
          "type": [
            "string",
            "null"
          ]
        },
        "tokenizer_config_sha256": {
          "type": [
            "string",
            "null"
          ],
          "pattern": "^[0-9a-f]{64}$"
        },
        "max_num_patches": {
          "type": [
            "integer",
            "null"
          ],
          "minimum": 1
        },
        "valid_patch_counts": {
          "type": [
            "array",
            "null"
          ],
          "items": {
            "type": "integer",
            "minimum": 1
          }
        },
        "valid_patch_counts_sha256": {
          "type": [
            "string",
            "null"
          ],
          "pattern": "^[0-9a-f]{64}$"
        },
        "prompt_name": {
          "type": [
            "string",
            "null"
          ]
        },
        "template_hash": {
          "type": [
            "string",
            "null"
          ]
        },
        "classnames_hash": {
          "type": [
            "string",
            "null"
          ]
        },
        "device": {
          "type": "string"
        },
        "gpu_name": {
          "type": [
            "string",
            "null"
          ]
        },
        "gpu_vram_bytes": {
          "type": [
            "integer",
            "null"
          ],
          "minimum": 0
        },
        "driver_version": {
          "type": [
            "string",
            "null"
          ]
        },
        "torch_version": {
          "type": [
            "string",
            "null"
          ]
        },
        "torch_cuda_version": {
          "type": [
            "string",
            "null"
          ]
        },
        "precision": {
          "enum": [
            "fp32",
            "bf16"
          ]
        },
        "amp_enabled": {
          "type": "boolean"
        },
        "batch_size_actual": {
          "type": [
            "integer",
            "null"
          ],
          "minimum": 1
        },
        "seed": {
          "type": "integer"
        },
        "throughput_images_per_sec": {
          "type": [
            "number",
            "null"
          ],
          "exclusiveMinimum": 0
        },
        "throughput_texts_per_sec": {
          "type": [
            "number",
            "null"
          ],
          "exclusiveMinimum": 0
        },
        "inference_ms_median": {
          "type": [
            "number",
            "null"
          ],
          "exclusiveMinimum": 0
        },
        "gpu_peak_allocated_bytes": {
          "type": [
            "integer",
            "null"
          ],
          "minimum": 0
        },
        "gpu_peak_reserved_bytes": {
          "type": [
            "integer",
            "null"
          ],
          "minimum": 0
        }
      },
      "allOf": [
        {
          "if": {
            "properties": {
              "status": {
                "const": "completed"
              }
            },
            "required": [
              "embedding_dimension"
            ]
          },
          "then": {
            "required": [
              "embedding_dimension_strategy",
              "native_embedding_dimension",
              "embedding_generation_mode"
            ]
          }
        },
        {
          "if": {
            "properties": {
              "reproducibility_mode": {
                "const": "strict"
              }
            },
            "required": [
              "reproducibility_mode"
            ]
          },
          "then": {
            "required": [
              "working_tree_dirty",
              "source_commit_sha",
              "expected_source_commit_sha",
              "staging_directory"
            ],
            "properties": {
              "working_tree_dirty": {
                "const": false
              },
              "source_commit_sha": {
                "type": "string",
                "pattern": "^[0-9a-f]{40}$"
              },
              "expected_source_commit_sha": {
                "type": "string",
                "pattern": "^[0-9a-f]{40}$"
              },
              "staging_directory": {
                "type": "string",
                "minLength": 1
              }
            }
          }
        },
        {
          "if": {
            "properties": {
              "status": {
                "not": {
                  "const": "completed"
                }
              }
            }
          },
          "then": {
            "required": [
              "reason_if_not_success"
            ]
          }
        }
      ],
      "additionalProperties": true
    }
  },
  "allOf": [
    {
      "if": {
        "properties": {
          "status": {
            "const": "completed"
          }
        }
      },
      "then": {
        "required": [
          "metrics"
        ]
      },
      "else": {
        "not": {
          "required": [
            "metrics"
          ]
        }
      }
    },
    {
      "if": {
        "properties": {
          "status": {
            "const": "completed"
          }
        }
      },
      "then": {
        "properties": {
          "benchmark_metadata": {
            "properties": {
              "status": {
                "const": "completed"
              }
            }
          }
        }
      }
    }
  ],
  "additionalProperties": true
}
