{
  "dataset": "cifar10",
  "model": "google/embeddinggemma-2",
  "pretrained": "official",
  "task": "classification",
  "language": "en",
  "status": "completed",
  "benchmark_metadata": {
    "schema_version": "1.0.0",
    "run_id": "cf413596e88f09f8",
    "configuration_hash": "cf413596e88f09f8398b6196ea858c5af6f2a3f3eacd6c43dfaafac5e41f0570",
    "timestamp_utc": "2026-10-20T17:07:41Z",
    "status": "completed",
    "reason_if_not_success": null,
    "source_commit_sha": "a9909fbe1b15dc66b44bca51a41651f8f3a5d30c",
    "working_tree_dirty": false,
    "framework_name": "vision-language-benchmarks",
    "framework_ref": "v0.1.0",
    "python_version": "3.12.10",
    "uv_lock_sha256": "9b2483aa176de5a66687b07b8d27e88ca6f371c39d020d70995cabe0e64368a5",
    "model_repo": "google/embeddinggemma-2",
    "checkpoint_revision": "914f7f89142e33e77833254d9c9b90c3cef7303b",
    "model_checkpoint_filename": "model.safetensors",
    "model_checkpoint_size_bytes": 1488915288,
    "model_languages": [
      "en",
      "ja"
    ],
    "model_repository_revision": null,
    "pretrained_tag": "official",
    "adapter_name": "openclip_gemma",
    "model_license": "Apache-2.0",
    "model_compatibility_note": "Uses the official Classification or SearchQuery task prompt; P0 scores are not numerically interchangeable with CLIP logits.",
    "checkpoint_sha256": "1ff16e54c7410c6a1c8a8fddd076136fba78368eec798b45a0f9532e83b2f510",
    "checkpoint_files": [
      {
        "path": "model.safetensors",
        "sha256": "197a32965d4b1105faf060417baa899e193fb73cd401f42ec9295234d5553d79"
      }
    ],
    "parameter_count": 744371488,
    "model_implementation_version": "0.4.0",
    "preprocessing_version": "0.4.0",
    "preprocessing_config": {
      "transform": "openclip_gemma.create_model_and_transforms",
      "input_resolution": null,
      "batching_strategy": "grouped_by_preprocessed_shape",
      "embedding_dimension": 128,
      "embedding_dimension_strategy": "leading-dimensions-l2-v1",
      "native_embedding_dimension": 768,
      "embedding_generation_mode": "native_truncate_dim"
    },
    "preprocessing_config_sha256": "0ee105ea22218f9e3743981d5050853c062f4ea4440e01f6436342982087c0b8",
    "tokenizer_implementation_version": "5.20.1",
    "tokenizer_repository": "google/embeddinggemma-2",
    "tokenizer_revision": "914f7f89142e33e77833254d9c9b90c3cef7303b",
    "tokenizer_license": null,
    "dataset_id": "cifar10",
    "dataset_revision": "CIFAR official python archive",
    "dataset_split": "test",
    "dataset_checksum": "744e4b130af776f7a1c7a19427963e1f6d1c63984a1bb2bc2ceb4da2ba54c470",
    "dataset_license": "The official University of Toronto page publishes the Python archive and requests citation of the dataset technical report; no separate acceptance agreement is displayed. This benchmark performs evaluation only and does not redistribute the archive.",
    "dataset_license_status": "public_download_citation_required",
    "dataset_terms_confirmed": false,
    "dataset_source": "https://www.cs.toronto.edu/~kriz/cifar-10-python.tar.gz",
    "dataset_integrity_status": "verified",
    "annotation_source": "Official CIFAR Python archive",
    "images_archive_sha256": null,
    "captions_archive_sha256": null,
    "image_files_sha256": null,
    "image_attributions_sha256": null,
    "image_count": 10000,
    "text_count": 180,
    "class_count": 10,
    "retrieval_variant": null,
    "retrieval_variant_reference_commit": null,
    "retrieval_variant_source": null,
    "caption_selection": null,
    "one_caption_per_image": null,
    "candidate_counts": null,
    "official_image_filtering": null,
    "caption_count_per_image_min": null,
    "caption_count_per_image_max": null,
    "text_content_sha256": null,
    "language": "en",
    "original_language_code": "en",
    "prompt_policy": "clip_benchmark_zeroshot_templates",
    "prompt_name": "Classification",
    "task_prompt": null,
    "template_hash": "46d33640b228c3541cc8eeadb21872cd53b2ab0b0f5e91f848bed75d85d93dae",
    "classnames_hash": "feb528d8ad763e4c89a96910f8ed9ea0113aa59fe89528e3f8804b4ae9b0d2e5",
    "image_id_scheme": "CIFAR test-split row index",
    "image_ids": null,
    "text_ids": null,
    "image_id_order_hash": "a74675bfed3834ac1c3140b2d7fb7d93d90a76608cc08515a5019a1cb2075ff4",
    "text_id_order_hash": "da28a72fada3b9551111c3e7d3e7805efe449d03c27589f773fdf63249f28e8d",
    "text_id_scheme": null,
    "positive_pair_count": null,
    "device": "cuda",
    "requested_device": "cuda",
    "gpu_name": "NVIDIA GeForce RTX 4070 Ti SUPER",
    "gpu_vram_bytes": 17170956288,
    "driver_version": "610.88",
    "torch_version": "2.14.1+cu130",
    "torch_cuda_version": "13.0",
    "precision": "fp32",
    "amp_enabled": false,
    "batch_size_requested": 16,
    "batch_size_actual": 16,
    "image_batch_size_actual": 16,
    "text_batch_size_actual": 16,
    "seed": 0,
    "model_download_seconds": 0.0744882000144571,
    "model_load_seconds": 7.203566999989562,
    "dataset_preparation_seconds": 1.652544400014449,
    "dataset_loading_seconds": 0.25670010002795607,
    "data_loading_seconds": 0.1541353000793606,
    "preprocessing_seconds": 10.694971699209418,
    "inference_seconds": 981.9921176003991,
    "image_inference_seconds": 981.2267098004231,
    "text_inference_seconds": 0.7654077999759465,
    "retrieval_aggregation_seconds": 0.0,
    "evaluation_wall_seconds": 1010.2737812999985,
    "throughput_images_per_sec": 10.191324696036814,
    "throughput_texts_per_sec": 235.16875580005407,
    "inference_ms_median": 1568.3582000201568,
    "inference_ms_iqr": 10.170500027015805,
    "image_inference_ms_median": 1568.5118999681436,
    "text_inference_ms_median": 63.614250015234575,
    "gpu_peak_allocated_bytes": 5339176448,
    "gpu_peak_reserved_bytes": 6339690496,
    "oom_history": [],
    "training_data_overlap_risk": "The model pretraining corpus is not independently verified to exclude this evaluation dataset; training-data contamination cannot be ruled out.",
    "run_configuration": {
      "model_key": "embeddinggemma2",
      "dataset_key": "cifar10",
      "protocol": "p0",
      "language": "en",
      "precision": "fp32",
      "device": "cuda",
      "batch_size_requested": 16,
      "seed": 0,
      "dataset_checksum": "744e4b130af776f7a1c7a19427963e1f6d1c63984a1bb2bc2ceb4da2ba54c470",
      "data_terms_confirmed": false,
      "embedding_dimension": 128,
      "reproducibility_mode": "strict",
      "expected_source_commit_sha": "a9909fbe1b15dc66b44bca51a41651f8f3a5d30c"
    },
    "embedding_dimension": 128,
    "embedding_dimension_strategy": "leading-dimensions-l2-v1",
    "native_embedding_dimension": 768,
    "embedding_generation_mode": "native_truncate_dim",
    "reproducibility_mode": "strict",
    "expected_source_commit_sha": "a9909fbe1b15dc66b44bca51a41651f8f3a5d30c",
    "staging_directory": ".cache/benchmark-staging/mrl-clean"
  },
  "metrics": {
    "acc1": 0.9035,
    "acc5": 0.9962
  }
}
