{
  "dataset": "cifar100",
  "model": "google/embeddinggemma-2",
  "pretrained": "official",
  "task": "classification",
  "language": "en",
  "status": "completed",
  "benchmark_metadata": {
    "schema_version": "1.0.0",
    "run_id": "0c75f5095220051c-f8285c69",
    "configuration_hash": "0c75f5095220051c346f9c5c7328cc317dbc3018218cd5c5adb66aba7d807596",
    "timestamp_utc": "2026-10-19T17:25:27Z",
    "status": "completed",
    "reason_if_not_success": null,
    "source_commit_sha": "60a61259c95e7c387e896b23084e3c3d0fc375f5",
    "working_tree_dirty": false,
    "framework_name": "vision-language-benchmarks",
    "framework_ref": "v0.1.0",
    "python_version": "3.12.10",
    "uv_lock_sha256": "3cc8412331db93db7590ef7bd759311ff1dc4be1dbfb1734a0b39395799a21b2",
    "model_repo": "google/embeddinggemma-2",
    "checkpoint_revision": "914f7f89142e33e77833254d9c9b90c3cef7303b",
    "model_checkpoint_filename": "model.safetensors",
    "model_checkpoint_size_bytes": 1488915288,
    "model_languages": [
      "en",
      "ja"
    ],
    "model_repository_revision": null,
    "pretrained_tag": "official",
    "adapter_name": "openclip_gemma",
    "model_license": "Apache-2.0",
    "model_compatibility_note": "Uses the official Classification or SearchQuery task prompt; P0 scores are not numerically interchangeable with CLIP logits.",
    "checkpoint_sha256": "1ff16e54c7410c6a1c8a8fddd076136fba78368eec798b45a0f9532e83b2f510",
    "checkpoint_files": [
      {
        "path": "model.safetensors",
        "sha256": "197a32965d4b1105faf060417baa899e193fb73cd401f42ec9295234d5553d79"
      }
    ],
    "parameter_count": 744371488,
    "model_implementation_version": "0.3.0",
    "tokenizer_repository": "google/embeddinggemma-2",
    "tokenizer_revision": "914f7f89142e33e77833254d9c9b90c3cef7303b",
    "tokenizer_license": null,
    "dataset_id": "cifar100",
    "dataset_revision": "CIFAR official python archive",
    "dataset_split": "test",
    "dataset_checksum": "e5b40f8042fe89ad338c43b208464e0001bcb4ffba8a6827ed0da83562323a1f",
    "dataset_license": "The official University of Toronto page publishes the Python archive and requests citation of the dataset technical report; no separate acceptance agreement is displayed. This benchmark performs evaluation only and does not redistribute the archive.",
    "dataset_license_status": "public_download_citation_required",
    "dataset_terms_confirmed": false,
    "dataset_source": "https://www.cs.toronto.edu/~kriz/cifar-100-python.tar.gz",
    "dataset_integrity_status": "verified",
    "annotation_source": "Official CIFAR Python archive",
    "image_count": 10000,
    "text_count": 100,
    "class_count": 100,
    "language": "en",
    "original_language_code": "en",
    "prompt_policy": "model_native_classification_task",
    "prompt_name": "Classification",
    "template_hash": "d47e60943bc086699e88c188e05832c11b4f4d4c1bbe06579388727241ef7e4f",
    "classnames_hash": "3d794a18a5f8b01726c944c1d81aa48b6e445b71255a084227918e55344adbbb",
    "image_id_scheme": "CIFAR test-split row index",
    "image_id_order_hash": "a74675bfed3834ac1c3140b2d7fb7d93d90a76608cc08515a5019a1cb2075ff4",
    "text_id_order_hash": "3d794a18a5f8b01726c944c1d81aa48b6e445b71255a084227918e55344adbbb",
    "positive_pair_count": null,
    "device": "cuda",
    "requested_device": "cuda",
    "gpu_name": "NVIDIA GeForce RTX 4070 Ti SUPER",
    "gpu_vram_bytes": 17170956288,
    "driver_version": "610.88",
    "torch_version": "2.14.1+cu130",
    "torch_cuda_version": "13.0",
    "precision": "fp32",
    "amp_enabled": false,
    "batch_size_requested": 16,
    "batch_size_actual": 16,
    "image_batch_size_actual": 16,
    "text_batch_size_actual": 16,
    "seed": 0,
    "model_download_seconds": 0.07377489999635145,
    "model_load_seconds": 7.938607700052671,
    "dataset_preparation_seconds": 1.5982156000100076,
    "dataset_loading_seconds": 0.2594804000109434,
    "data_loading_seconds": 0.17738529964117333,
    "preprocessing_seconds": 11.608231000544038,
    "inference_seconds": 977.5122839991236,
    "image_inference_seconds": 977.1186871991376,
    "text_inference_seconds": 0.3935967999859713,
    "retrieval_aggregation_seconds": 0.0,
    "evaluation_wall_seconds": 1008.3112285000389,
    "throughput_images_per_sec": 10.234171274182161,
    "throughput_texts_per_sec": 254.0671062456916,
    "inference_ms_median": 1564.4510500424076,
    "inference_ms_iqr": 18.3826749707805,
    "image_inference_ms_median": 1564.7030000109226,
    "text_inference_ms_median": 56.22420000145212,
    "gpu_peak_allocated_bytes": 5340159488,
    "gpu_peak_reserved_bytes": 6333399040,
    "oom_history": [],
    "training_data_overlap_risk": "The model pretraining corpus is not independently verified to exclude this evaluation dataset; training-data contamination cannot be ruled out.",
    "run_configuration": {
      "model_key": "embeddinggemma2",
      "dataset_key": "cifar100",
      "protocol": "p1",
      "language": "en",
      "precision": "fp32",
      "device": "cuda",
      "batch_size_requested": 16,
      "seed": 0,
      "dataset_checksum": "e5b40f8042fe89ad338c43b208464e0001bcb4ffba8a6827ed0da83562323a1f",
      "data_terms_confirmed": false
    }
  },
  "metrics": {
    "acc1": 0.6284,
    "acc5": 0.8404
  }
}
