{
  "dataset": "cifar100",
  "model": "ViT-B-32",
  "pretrained": "openai",
  "task": "classification",
  "language": "en",
  "status": "completed",
  "benchmark_metadata": {
    "schema_version": "1.0.0",
    "run_id": "c08f92332ebe01a4-2815d62c",
    "configuration_hash": "c08f92332ebe01a480413604c7fea38a5fea4ed0de5e952850b1b77235dafbc3",
    "timestamp_utc": "2026-10-19T17:06:06Z",
    "status": "completed",
    "reason_if_not_success": null,
    "source_commit_sha": "60a61259c95e7c387e896b23084e3c3d0fc375f5",
    "working_tree_dirty": false,
    "framework_name": "vision-language-benchmarks",
    "framework_ref": "v0.1.0",
    "python_version": "3.12.10",
    "uv_lock_sha256": "3cc8412331db93db7590ef7bd759311ff1dc4be1dbfb1734a0b39395799a21b2",
    "model_repo": "ViT-B-32",
    "checkpoint_revision": null,
    "model_checkpoint_filename": "ViT-B-32.pt",
    "model_checkpoint_size_bytes": 353976522,
    "model_languages": [
      "en"
    ],
    "model_repository_revision": null,
    "pretrained_tag": "openai",
    "adapter_name": "open_clip",
    "model_license": "MIT",
    "model_compatibility_note": "The OpenAI checkpoint is selected by the open_clip 'openai' tag; record its downloaded checkpoint hash because the upstream weight is not a revision-addressable Hugging Face repository.",
    "checkpoint_sha256": "e6d1bd7789aa45192b3bf90570a789b478bae1b74ebcce7eddd908e83a2b7c31",
    "checkpoint_files": [
      {
        "path": "open_clip_model.safetensors",
        "sha256": "e6d1bd7789aa45192b3bf90570a789b478bae1b74ebcce7eddd908e83a2b7c31"
      }
    ],
    "parameter_count": 151277313,
    "model_implementation_version": "3.3.0",
    "tokenizer_repository": "open_clip:ViT-B-32",
    "tokenizer_revision": null,
    "tokenizer_license": null,
    "dataset_id": "cifar100",
    "dataset_revision": "CIFAR official python archive",
    "dataset_split": "test",
    "dataset_checksum": "e5b40f8042fe89ad338c43b208464e0001bcb4ffba8a6827ed0da83562323a1f",
    "dataset_license": "The official University of Toronto page publishes the Python archive and requests citation of the dataset technical report; no separate acceptance agreement is displayed. This benchmark performs evaluation only and does not redistribute the archive.",
    "dataset_license_status": "public_download_citation_required",
    "dataset_terms_confirmed": false,
    "dataset_source": "https://www.cs.toronto.edu/~kriz/cifar-100-python.tar.gz",
    "dataset_integrity_status": "verified",
    "annotation_source": "Official CIFAR Python archive",
    "image_count": 10000,
    "text_count": 100,
    "class_count": 100,
    "language": "en",
    "original_language_code": "en",
    "prompt_policy": "model_native_single_photo_template",
    "prompt_name": null,
    "template_hash": "1a7ad742a760cf7c54acf056e887b6334981df5e844ce2dc398d2cbac5140f68",
    "classnames_hash": "3d794a18a5f8b01726c944c1d81aa48b6e445b71255a084227918e55344adbbb",
    "image_id_scheme": "CIFAR test-split row index",
    "image_id_order_hash": "a74675bfed3834ac1c3140b2d7fb7d93d90a76608cc08515a5019a1cb2075ff4",
    "text_id_order_hash": "1c031ddca7a34a4c3c48bd3a7aedc844bc42efe737d60aeece3c377ab2d8e596",
    "positive_pair_count": null,
    "device": "cuda",
    "requested_device": "cuda",
    "gpu_name": "NVIDIA GeForce RTX 4070 Ti SUPER",
    "gpu_vram_bytes": 17170956288,
    "driver_version": "610.88",
    "torch_version": "2.14.1+cu130",
    "torch_cuda_version": "13.0",
    "precision": "fp32",
    "amp_enabled": false,
    "batch_size_requested": 16,
    "batch_size_actual": 16,
    "image_batch_size_actual": 16,
    "text_batch_size_actual": 16,
    "seed": 0,
    "model_download_seconds": 0.27434429997811094,
    "model_load_seconds": 3.64446110004792,
    "dataset_preparation_seconds": 1.5973037999938242,
    "dataset_loading_seconds": 0.2564853000221774,
    "data_loading_seconds": 0.23256639984901994,
    "preprocessing_seconds": 9.987430300272536,
    "inference_seconds": 13.930408399784938,
    "image_inference_seconds": 13.826933399832342,
    "text_inference_seconds": 0.10347499995259568,
    "retrieval_aggregation_seconds": 0.0,
    "evaluation_wall_seconds": 28.669896800012793,
    "throughput_images_per_sec": 723.2261638087629,
    "throughput_texts_per_sec": 966.4170093820956,
    "inference_ms_median": 21.767949976492673,
    "inference_ms_iqr": 5.925625024246983,
    "image_inference_ms_median": 21.797999972477555,
    "text_inference_ms_median": 14.702699962072074,
    "gpu_peak_allocated_bytes": 665426944,
    "gpu_peak_reserved_bytes": 729808896,
    "oom_history": [],
    "training_data_overlap_risk": "The model pretraining corpus is not independently verified to exclude this evaluation dataset; training-data contamination cannot be ruled out.",
    "run_configuration": {
      "model_key": "openai_clip_b32",
      "dataset_key": "cifar100",
      "protocol": "p1",
      "language": "en",
      "precision": "fp32",
      "device": "cuda",
      "batch_size_requested": 16,
      "seed": 0,
      "dataset_checksum": "e5b40f8042fe89ad338c43b208464e0001bcb4ffba8a6827ed0da83562323a1f",
      "data_terms_confirmed": false
    }
  },
  "metrics": {
    "acc1": 0.6232,
    "acc5": 0.87
  }
}
